2025-09-02 22:30:05,640 | INFO | ================================================================================
2025-09-02 22:30:05,640 | INFO | DSTRETCH PYTHON VALIDATION LOG STARTED
2025-09-02 22:30:05,640 | INFO | Results Directory: G:\dstretch_python\validation_results\review_2025-09-02_223005
2025-09-02 22:30:05,641 | INFO | ================================================================================
2025-09-02 22:30:05,641 | INFO | Validator initialized. All results will be saved to: validation_results\review_2025-09-02_223005
2025-09-02 22:30:05,641 | INFO | Initialized with 21 colorspace mappings
2025-09-02 22:30:05,641 | INFO | Starting automatic validation process
2025-09-02 22:30:05,642 | INFO | Discovering images in: validation_images
2025-09-02 22:30:05,644 | INFO | Discovery complete: 40 processed images found
2025-09-02 22:30:05,644 | INFO | Grouped into 5 original images
2025-09-02 22:30:05,644 | INFO |   13-: 8 variants - ['CRGB', 'LAB', 'LDS', 'LRE', 'YBK', 'YRD', 'YRE', 'YYE']
2025-09-02 22:30:05,644 | INFO |   256734ca624db14c24b119a773d9b83757be829dw: 8 variants - ['CRGB', 'LAB', 'LDS', 'LRE', 'YBK', 'YRD', 'YRE', 'YYE']
2025-09-02 22:30:05,645 | INFO |   ARTE-RUPESTRE: 8 variants - ['CRGB', 'LAB', 'LDS', 'LRE', 'YBK', 'YRD', 'YRE', 'YYE']
2025-09-02 22:30:05,645 | INFO |   SantaCruz-CuevaManos-P2210651b: 8 variants - ['CRGB', 'LAB', 'LDS', 'LRE', 'YBK', 'YRD', 'YRE', 'YYE']
2025-09-02 22:30:05,645 | INFO |   test: 8 variants - ['CRGB', 'LAB', 'LDS', 'LRE', 'YBK', 'YRD', 'YRE', 'YYE']
2025-09-02 22:30:05,645 | INFO | --- Processing: 13-_crgb_scale15.jpg ---
2025-09-02 22:30:05,646 | INFO | Original found: 13-.jpg for 13-
2025-09-02 22:30:06,805 | INFO | Validation successful: CRGB | MSE=0.6 | SSIM=1.000 | STATUS: EXCELLENT
2025-09-02 22:30:06,805 | INFO | --- Processing: 13-_lab_scale15.jpg ---
2025-09-02 22:30:06,805 | INFO | Original found: 13-.jpg for 13-
2025-09-02 22:30:08,135 | INFO | Validation successful: LAB | MSE=3.5 | SSIM=1.000 | STATUS: EXCELLENT
2025-09-02 22:30:08,135 | INFO | --- Processing: 13-_lds_scale15.jpg ---
2025-09-02 22:30:08,136 | INFO | Original found: 13-.jpg for 13-
2025-09-02 22:30:09,449 | INFO | Validation successful: LDS | MSE=3.3 | SSIM=1.000 | STATUS: EXCELLENT
2025-09-02 22:30:09,449 | INFO | --- Processing: 13-_lre_scale15.jpg ---
2025-09-02 22:30:09,450 | INFO | Original found: 13-.jpg for 13-
2025-09-02 22:30:10,748 | INFO | Validation successful: LRE | MSE=1.0 | SSIM=1.000 | STATUS: EXCELLENT
2025-09-02 22:30:10,748 | INFO | --- Processing: 13-_ybk_scale15.jpg ---
2025-09-02 22:30:10,748 | INFO | Original found: 13-.jpg for 13-
2025-09-02 22:30:11,873 | INFO | Validation successful: YBK | MSE=0.6 | SSIM=1.000 | STATUS: EXCELLENT
2025-09-02 22:30:11,873 | INFO | --- Processing: 13-_yrd_scale15.jpg ---
2025-09-02 22:30:11,873 | INFO | Original found: 13-.jpg for 13-
2025-09-02 22:30:13,022 | INFO | Validation successful: YRD | MSE=0.6 | SSIM=1.000 | STATUS: EXCELLENT
2025-09-02 22:30:13,022 | INFO | --- Processing: 13-_yre_scale15.jpg ---
2025-09-02 22:30:13,023 | INFO | Original found: 13-.jpg for 13-
2025-09-02 22:30:14,322 | INFO | Validation successful: YRE | MSE=0.6 | SSIM=1.000 | STATUS: EXCELLENT
2025-09-02 22:30:14,322 | INFO | --- Processing: 13-_yye_scale15.jpg ---
2025-09-02 22:30:14,322 | INFO | Original found: 13-.jpg for 13-
2025-09-02 22:30:15,474 | INFO | Validation successful: YYE | MSE=0.6 | SSIM=1.000 | STATUS: EXCELLENT
2025-09-02 22:30:15,475 | INFO | --- Processing: 256734ca624db14c24b119a773d9b83757be829dw_crgb_scale15.jpg ---
2025-09-02 22:30:15,475 | INFO | Original found: 256734ca624db14c24b119a773d9b83757be829dw.jpg for 256734ca624db14c24b119a773d9b83757be829dw
2025-09-02 22:30:16,462 | INFO | Validation successful: CRGB | MSE=0.6 | SSIM=1.000 | STATUS: EXCELLENT
2025-09-02 22:30:16,463 | INFO | --- Processing: 256734ca624db14c24b119a773d9b83757be829dw_lab_scale15.jpg ---
2025-09-02 22:30:16,463 | INFO | Original found: 256734ca624db14c24b119a773d9b83757be829dw.jpg for 256734ca624db14c24b119a773d9b83757be829dw
2025-09-02 22:30:17,594 | INFO | Validation successful: LAB | MSE=1.6 | SSIM=1.000 | STATUS: EXCELLENT
2025-09-02 22:30:17,594 | INFO | --- Processing: 256734ca624db14c24b119a773d9b83757be829dw_lds_scale15.jpg ---
2025-09-02 22:30:17,595 | INFO | Original found: 256734ca624db14c24b119a773d9b83757be829dw.jpg for 256734ca624db14c24b119a773d9b83757be829dw
2025-09-02 22:30:18,800 | INFO | Validation successful: LDS | MSE=1.9 | SSIM=1.000 | STATUS: EXCELLENT
2025-09-02 22:30:18,800 | INFO | --- Processing: 256734ca624db14c24b119a773d9b83757be829dw_lre_scale15.jpg ---
2025-09-02 22:30:18,801 | INFO | Original found: 256734ca624db14c24b119a773d9b83757be829dw.jpg for 256734ca624db14c24b119a773d9b83757be829dw
2025-09-02 22:30:19,930 | INFO | Validation successful: LRE | MSE=1.0 | SSIM=1.000 | STATUS: EXCELLENT
2025-09-02 22:30:19,931 | INFO | --- Processing: 256734ca624db14c24b119a773d9b83757be829dw_ybk_scale15.jpg ---
2025-09-02 22:30:19,931 | INFO | Original found: 256734ca624db14c24b119a773d9b83757be829dw.jpg for 256734ca624db14c24b119a773d9b83757be829dw
2025-09-02 22:30:20,946 | INFO | Validation successful: YBK | MSE=0.6 | SSIM=1.000 | STATUS: EXCELLENT
2025-09-02 22:30:20,946 | INFO | --- Processing: 256734ca624db14c24b119a773d9b83757be829dw_yrd_scale15.jpg ---
2025-09-02 22:30:20,946 | INFO | Original found: 256734ca624db14c24b119a773d9b83757be829dw.jpg for 256734ca624db14c24b119a773d9b83757be829dw
2025-09-02 22:30:21,950 | INFO | Validation successful: YRD | MSE=0.6 | SSIM=1.000 | STATUS: EXCELLENT
2025-09-02 22:30:21,950 | INFO | --- Processing: 256734ca624db14c24b119a773d9b83757be829dw_yre_scale15.jpg ---
2025-09-02 22:30:21,951 | INFO | Original found: 256734ca624db14c24b119a773d9b83757be829dw.jpg for 256734ca624db14c24b119a773d9b83757be829dw
2025-09-02 22:30:22,950 | INFO | Validation successful: YRE | MSE=0.6 | SSIM=1.000 | STATUS: EXCELLENT
2025-09-02 22:30:22,950 | INFO | --- Processing: 256734ca624db14c24b119a773d9b83757be829dw_yye_scale15.jpg ---
2025-09-02 22:30:22,950 | INFO | Original found: 256734ca624db14c24b119a773d9b83757be829dw.jpg for 256734ca624db14c24b119a773d9b83757be829dw
2025-09-02 22:30:24,017 | INFO | Validation successful: YYE | MSE=0.6 | SSIM=1.000 | STATUS: EXCELLENT
2025-09-02 22:30:24,017 | INFO | --- Processing: ARTE-RUPESTRE_crgb_scale15.jpg ---
2025-09-02 22:30:24,018 | INFO | Original found: ARTE-RUPESTRE.jpg for ARTE-RUPESTRE
2025-09-02 22:30:25,008 | INFO | Validation successful: CRGB | MSE=0.5 | SSIM=1.000 | STATUS: EXCELLENT
2025-09-02 22:30:25,008 | INFO | --- Processing: ARTE-RUPESTRE_lab_scale15.jpg ---
2025-09-02 22:30:25,009 | INFO | Original found: ARTE-RUPESTRE.jpg for ARTE-RUPESTRE
2025-09-02 22:30:26,150 | INFO | Validation successful: LAB | MSE=1.2 | SSIM=1.000 | STATUS: EXCELLENT
2025-09-02 22:30:26,150 | INFO | --- Processing: ARTE-RUPESTRE_lds_scale15.jpg ---
2025-09-02 22:30:26,151 | INFO | Original found: ARTE-RUPESTRE.jpg for ARTE-RUPESTRE
2025-09-02 22:30:27,303 | INFO | Validation successful: LDS | MSE=1.6 | SSIM=1.000 | STATUS: EXCELLENT
2025-09-02 22:30:27,303 | INFO | --- Processing: ARTE-RUPESTRE_lre_scale15.jpg ---
2025-09-02 22:30:27,304 | INFO | Original found: ARTE-RUPESTRE.jpg for ARTE-RUPESTRE
2025-09-02 22:30:28,492 | INFO | Validation successful: LRE | MSE=0.9 | SSIM=1.000 | STATUS: EXCELLENT
2025-09-02 22:30:28,492 | INFO | --- Processing: ARTE-RUPESTRE_ybk_scale15.jpg ---
2025-09-02 22:30:28,492 | INFO | Original found: ARTE-RUPESTRE.jpg for ARTE-RUPESTRE
2025-09-02 22:30:29,629 | INFO | Validation successful: YBK | MSE=0.6 | SSIM=1.000 | STATUS: EXCELLENT
2025-09-02 22:30:29,629 | INFO | --- Processing: ARTE-RUPESTRE_yrd_scale15.jpg ---
2025-09-02 22:30:29,630 | INFO | Original found: ARTE-RUPESTRE.jpg for ARTE-RUPESTRE
2025-09-02 22:30:30,666 | INFO | Validation successful: YRD | MSE=0.6 | SSIM=1.000 | STATUS: EXCELLENT
2025-09-02 22:30:30,666 | INFO | --- Processing: ARTE-RUPESTRE_yre_scale15.jpg ---
2025-09-02 22:30:30,667 | INFO | Original found: ARTE-RUPESTRE.jpg for ARTE-RUPESTRE
2025-09-02 22:30:31,715 | INFO | Validation successful: YRE | MSE=0.6 | SSIM=1.000 | STATUS: EXCELLENT
2025-09-02 22:30:31,715 | INFO | --- Processing: ARTE-RUPESTRE_yye_scale15.jpg ---
2025-09-02 22:30:31,716 | INFO | Original found: ARTE-RUPESTRE.jpg for ARTE-RUPESTRE
2025-09-02 22:30:32,736 | INFO | Validation successful: YYE | MSE=0.6 | SSIM=1.000 | STATUS: EXCELLENT
2025-09-02 22:30:32,736 | INFO | --- Processing: SantaCruz-CuevaManos-P2210651b_crgb_scale15.jpg ---
2025-09-02 22:30:32,737 | INFO | Original found: SantaCruz-CuevaManos-P2210651b.jpg for SantaCruz-CuevaManos-P2210651b
2025-09-02 22:30:34,198 | INFO | Validation successful: CRGB | MSE=0.5 | SSIM=1.000 | STATUS: EXCELLENT
2025-09-02 22:30:34,199 | INFO | --- Processing: SantaCruz-CuevaManos-P2210651b_lab_scale15.jpg ---
2025-09-02 22:30:34,199 | INFO | Original found: SantaCruz-CuevaManos-P2210651b.jpg for SantaCruz-CuevaManos-P2210651b
2025-09-02 22:30:36,206 | INFO | Validation successful: LAB | MSE=1.7 | SSIM=1.000 | STATUS: EXCELLENT
2025-09-02 22:30:36,206 | INFO | --- Processing: SantaCruz-CuevaManos-P2210651b_lds_scale15.jpg ---
2025-09-02 22:30:36,207 | INFO | Original found: SantaCruz-CuevaManos-P2210651b.jpg for SantaCruz-CuevaManos-P2210651b
2025-09-02 22:30:38,231 | INFO | Validation successful: LDS | MSE=1.2 | SSIM=1.000 | STATUS: EXCELLENT
2025-09-02 22:30:38,232 | INFO | --- Processing: SantaCruz-CuevaManos-P2210651b_lre_scale15.jpg ---
2025-09-02 22:30:38,232 | INFO | Original found: SantaCruz-CuevaManos-P2210651b.jpg for SantaCruz-CuevaManos-P2210651b
2025-09-02 22:30:40,239 | INFO | Validation successful: LRE | MSE=1.0 | SSIM=0.999 | STATUS: EXCELLENT
2025-09-02 22:30:40,239 | INFO | --- Processing: SantaCruz-CuevaManos-P2210651b_ybk_scale15.jpg ---
2025-09-02 22:30:40,240 | INFO | Original found: SantaCruz-CuevaManos-P2210651b.jpg for SantaCruz-CuevaManos-P2210651b
2025-09-02 22:30:41,810 | INFO | Validation successful: YBK | MSE=0.6 | SSIM=1.000 | STATUS: EXCELLENT
2025-09-02 22:30:41,810 | INFO | --- Processing: SantaCruz-CuevaManos-P2210651b_yrd_scale15.jpg ---
2025-09-02 22:30:41,811 | INFO | Original found: SantaCruz-CuevaManos-P2210651b.jpg for SantaCruz-CuevaManos-P2210651b
2025-09-02 22:30:43,457 | INFO | Validation successful: YRD | MSE=0.6 | SSIM=1.000 | STATUS: EXCELLENT
2025-09-02 22:30:43,458 | INFO | --- Processing: SantaCruz-CuevaManos-P2210651b_yre_scale15.jpg ---
2025-09-02 22:30:43,459 | INFO | Original found: SantaCruz-CuevaManos-P2210651b.jpg for SantaCruz-CuevaManos-P2210651b
2025-09-02 22:30:45,004 | INFO | Validation successful: YRE | MSE=0.6 | SSIM=1.000 | STATUS: EXCELLENT
2025-09-02 22:30:45,004 | INFO | --- Processing: SantaCruz-CuevaManos-P2210651b_yye_scale15.jpg ---
2025-09-02 22:30:45,005 | INFO | Original found: SantaCruz-CuevaManos-P2210651b.jpg for SantaCruz-CuevaManos-P2210651b
2025-09-02 22:30:46,567 | INFO | Validation successful: YYE | MSE=0.6 | SSIM=1.000 | STATUS: EXCELLENT
2025-09-02 22:30:46,567 | INFO | --- Processing: test_crgb_scale15.jpg ---
2025-09-02 22:30:46,573 | INFO | Original found: test.png for test
2025-09-02 22:30:47,798 | INFO | Validation successful: CRGB | MSE=0.5 | SSIM=1.000 | STATUS: EXCELLENT
2025-09-02 22:30:47,798 | INFO | --- Processing: test_lab_scale15.jpg ---
2025-09-02 22:30:47,803 | INFO | Original found: test.png for test
2025-09-02 22:30:49,261 | INFO | Validation successful: LAB | MSE=1.9 | SSIM=1.000 | STATUS: EXCELLENT
2025-09-02 22:30:49,261 | INFO | --- Processing: test_lds_scale15.jpg ---
2025-09-02 22:30:49,266 | INFO | Original found: test.png for test
2025-09-02 22:30:50,896 | INFO | Validation successful: LDS | MSE=2.3 | SSIM=1.000 | STATUS: EXCELLENT
2025-09-02 22:30:50,897 | INFO | --- Processing: test_lre_scale15.jpg ---
2025-09-02 22:30:50,901 | INFO | Original found: test.png for test
2025-09-02 22:30:52,361 | INFO | Validation successful: LRE | MSE=1.2 | SSIM=0.999 | STATUS: EXCELLENT
2025-09-02 22:30:52,361 | INFO | --- Processing: test_ybk_scale15.jpg ---
2025-09-02 22:30:52,366 | INFO | Original found: test.png for test
2025-09-02 22:30:53,610 | INFO | Validation successful: YBK | MSE=0.6 | SSIM=1.000 | STATUS: EXCELLENT
2025-09-02 22:30:53,610 | INFO | --- Processing: test_yrd_scale15.jpg ---
2025-09-02 22:30:53,615 | INFO | Original found: test.png for test
2025-09-02 22:30:54,863 | INFO | Validation successful: YRD | MSE=0.6 | SSIM=1.000 | STATUS: EXCELLENT
2025-09-02 22:30:54,863 | INFO | --- Processing: test_yre_scale15.jpg ---
2025-09-02 22:30:54,868 | INFO | Original found: test.png for test
2025-09-02 22:30:56,196 | INFO | Validation successful: YRE | MSE=0.6 | SSIM=1.000 | STATUS: EXCELLENT
2025-09-02 22:30:56,196 | INFO | --- Processing: test_yye_scale15.jpg ---
2025-09-02 22:30:56,202 | INFO | Original found: test.png for test
2025-09-02 22:30:57,471 | INFO | Validation successful: YYE | MSE=0.6 | SSIM=1.000 | STATUS: EXCELLENT
2025-09-02 22:30:57,472 | INFO | ==================================================
2025-09-02 22:30:57,472 | INFO | VALIDATION COMPLETED
2025-09-02 22:30:57,472 | INFO | Successfully validated: 40
2025-09-02 22:30:57,472 | INFO | Failed/Skipped validations: 0
2025-09-02 22:30:57,472 | INFO | Total processed: 40
2025-09-02 22:30:57,473 | INFO | ================================================================================
2025-09-02 22:30:57,473 | INFO | COMPREHENSIVE VALIDATION REPORT
2025-09-02 22:30:57,473 | INFO | ================================================================================
2025-09-02 22:30:57,473 | INFO | RESULTS BY COLORSPACE:
2025-09-02 22:30:57,473 | INFO | --------------------------------------------------------------------------------
2025-09-02 22:30:57,474 | INFO | Colorspace Tests  Excellent  Good   Accept  Needs Fix  Avg MSE  Avg SSIM 
2025-09-02 22:30:57,474 | INFO | --------------------------------------------------------------------------------
2025-09-02 22:30:57,475 | INFO | CRGB       5      5          0      0       0          0.5      1.000    
2025-09-02 22:30:57,475 | INFO | LAB        5      5          0      0       0          2.0      1.000    
2025-09-02 22:30:57,475 | INFO | LDS        5      5          0      0       0          2.1      1.000    
2025-09-02 22:30:57,475 | INFO | LRE        5      5          0      0       0          1.0      1.000    
2025-09-02 22:30:57,475 | INFO | YBK        5      5          0      0       0          0.6      1.000    
2025-09-02 22:30:57,476 | INFO | YRD        5      5          0      0       0          0.6      1.000    
2025-09-02 22:30:57,476 | INFO | YRE        5      5          0      0       0          0.6      1.000    
2025-09-02 22:30:57,476 | INFO | YYE        5      5          0      0       0          0.6      1.000    
2025-09-02 22:30:57,476 | INFO | ================================================================================
2025-09-02 22:30:57,476 | INFO | FINAL SUMMARY:
2025-09-02 22:30:57,477 | INFO |   Total validations: 40
2025-09-02 22:30:57,477 | INFO |   Excellent: 40 (100.0%)
2025-09-02 22:30:57,477 | INFO |   Good: 0 (0.0%)
2025-09-02 22:30:57,477 | INFO |   Acceptable: 0 (0.0%)
2025-09-02 22:30:57,477 | INFO |   Needs Adjustment: 0 (0.0%)
2025-09-02 22:30:57,477 | INFO |   SUCCESS RATE (Excellent + Good): 100.0%
2025-09-02 22:30:57,478 | INFO |   🎉 VALIDATION SUCCESSFUL
2025-09-02 22:30:57,480 | INFO | Analysis logs exported to results directory:
2025-09-02 22:30:57,480 | INFO |   - CSV Summary: validation_summary_2025-09-02_223005.csv
2025-09-02 22:30:57,480 | INFO |   - Detailed JSON: validation_report_2025-09-02_223005.json
2025-09-02 22:30:57,481 | INFO |   - Main Log File: G:\dstretch_python\validation_results\review_2025-09-02_223005\validation_log_2025-09-02_223005.log
