2025-09-02 22:08:04,875 | INFO | ================================================================================
2025-09-02 22:08:04,875 | INFO | DSTRETCH PYTHON VALIDATION LOG STARTED
2025-09-02 22:08:04,876 | INFO | Results Directory: G:\dstretch_python\validation_results\review_2025-09-02_220804
2025-09-02 22:08:04,876 | INFO | ================================================================================
2025-09-02 22:08:04,877 | INFO | Validator initialized. All results will be saved to: validation_results\review_2025-09-02_220804
2025-09-02 22:08:04,877 | INFO | Initialized with 21 colorspace mappings
2025-09-02 22:08:04,877 | INFO | Starting automatic validation process
2025-09-02 22:08:04,877 | INFO | Discovering images in: validation_images
2025-09-02 22:08:04,879 | INFO | Discovery complete: 40 processed images found
2025-09-02 22:08:04,880 | INFO | Grouped into 5 original images
2025-09-02 22:08:04,880 | INFO |   13-: 8 variants - ['CRGB', 'LAB', 'LDS', 'LRE', 'YBK', 'YRD', 'YRE', 'YYE']
2025-09-02 22:08:04,880 | INFO |   256734ca624db14c24b119a773d9b83757be829dw: 8 variants - ['CRGB', 'LAB', 'LDS', 'LRE', 'YBK', 'YRD', 'YRE', 'YYE']
2025-09-02 22:08:04,880 | INFO |   ARTE-RUPESTRE: 8 variants - ['CRGB', 'LAB', 'LDS', 'LRE', 'YBK', 'YRD', 'YRE', 'YYE']
2025-09-02 22:08:04,881 | INFO |   SantaCruz-CuevaManos-P2210651b: 8 variants - ['CRGB', 'LAB', 'LDS', 'LRE', 'YBK', 'YRD', 'YRE', 'YYE']
2025-09-02 22:08:04,881 | INFO |   test: 8 variants - ['CRGB', 'LAB', 'LDS', 'LRE', 'YBK', 'YRD', 'YRE', 'YYE']
2025-09-02 22:08:04,881 | INFO | --- Processing: 13-_crgb_scale15.jpg ---
2025-09-02 22:08:04,882 | INFO | Original found: 13-.jpg for 13-
2025-09-02 22:08:06,478 | INFO | Validation successful: CRGB | MSE=0.6 | SSIM=1.000 | STATUS: EXCELLENT
2025-09-02 22:08:06,478 | INFO | --- Processing: 13-_lab_scale15.jpg ---
2025-09-02 22:08:06,478 | INFO | Original found: 13-.jpg for 13-
2025-09-02 22:08:07,769 | INFO | Validation successful: LAB | MSE=474.4 | SSIM=0.926 | STATUS: NEEDS_ADJUSTMENT
2025-09-02 22:08:07,769 | INFO | --- Processing: 13-_lds_scale15.jpg ---
2025-09-02 22:08:07,769 | INFO | Original found: 13-.jpg for 13-
2025-09-02 22:08:09,019 | INFO | Validation successful: LDS | MSE=1420.1 | SSIM=0.848 | STATUS: NEEDS_ADJUSTMENT
2025-09-02 22:08:09,020 | INFO | --- Processing: 13-_lre_scale15.jpg ---
2025-09-02 22:08:09,020 | INFO | Original found: 13-.jpg for 13-
2025-09-02 22:08:10,246 | INFO | Validation successful: LRE | MSE=3493.1 | SSIM=0.513 | STATUS: NEEDS_ADJUSTMENT
2025-09-02 22:08:10,246 | INFO | --- Processing: 13-_ybk_scale15.jpg ---
2025-09-02 22:08:10,247 | INFO | Original found: 13-.jpg for 13-
2025-09-02 22:08:11,333 | INFO | Validation successful: YBK | MSE=1074.0 | SSIM=0.626 | STATUS: NEEDS_ADJUSTMENT
2025-09-02 22:08:11,333 | INFO | --- Processing: 13-_yrd_scale15.jpg ---
2025-09-02 22:08:11,333 | INFO | Original found: 13-.jpg for 13-
2025-09-02 22:08:12,446 | INFO | Validation successful: YRD | MSE=996.5 | SSIM=0.616 | STATUS: NEEDS_ADJUSTMENT
2025-09-02 22:08:12,446 | INFO | --- Processing: 13-_yre_scale15.jpg ---
2025-09-02 22:08:12,447 | INFO | Original found: 13-.jpg for 13-
2025-09-02 22:08:13,615 | INFO | Validation successful: YRE | MSE=845.1 | SSIM=0.625 | STATUS: NEEDS_ADJUSTMENT
2025-09-02 22:08:13,616 | INFO | --- Processing: 13-_yye_scale15.jpg ---
2025-09-02 22:08:13,616 | INFO | Original found: 13-.jpg for 13-
2025-09-02 22:08:14,698 | INFO | Validation successful: YYE | MSE=1300.7 | SSIM=0.638 | STATUS: NEEDS_ADJUSTMENT
2025-09-02 22:08:14,698 | INFO | --- Processing: 256734ca624db14c24b119a773d9b83757be829dw_crgb_scale15.jpg ---
2025-09-02 22:08:14,699 | INFO | Original found: 256734ca624db14c24b119a773d9b83757be829dw.jpg for 256734ca624db14c24b119a773d9b83757be829dw
2025-09-02 22:08:15,661 | INFO | Validation successful: CRGB | MSE=0.6 | SSIM=1.000 | STATUS: EXCELLENT
2025-09-02 22:08:15,661 | INFO | --- Processing: 256734ca624db14c24b119a773d9b83757be829dw_lab_scale15.jpg ---
2025-09-02 22:08:15,662 | INFO | Original found: 256734ca624db14c24b119a773d9b83757be829dw.jpg for 256734ca624db14c24b119a773d9b83757be829dw
2025-09-02 22:08:16,766 | INFO | Validation successful: LAB | MSE=499.9 | SSIM=0.921 | STATUS: NEEDS_ADJUSTMENT
2025-09-02 22:08:16,766 | INFO | --- Processing: 256734ca624db14c24b119a773d9b83757be829dw_lds_scale15.jpg ---
2025-09-02 22:08:16,766 | INFO | Original found: 256734ca624db14c24b119a773d9b83757be829dw.jpg for 256734ca624db14c24b119a773d9b83757be829dw
2025-09-02 22:08:17,876 | INFO | Validation successful: LDS | MSE=1703.0 | SSIM=0.825 | STATUS: NEEDS_ADJUSTMENT
2025-09-02 22:08:17,876 | INFO | --- Processing: 256734ca624db14c24b119a773d9b83757be829dw_lre_scale15.jpg ---
2025-09-02 22:08:17,877 | INFO | Original found: 256734ca624db14c24b119a773d9b83757be829dw.jpg for 256734ca624db14c24b119a773d9b83757be829dw
2025-09-02 22:08:19,042 | INFO | Validation successful: LRE | MSE=4110.1 | SSIM=0.448 | STATUS: NEEDS_ADJUSTMENT
2025-09-02 22:08:19,043 | INFO | --- Processing: 256734ca624db14c24b119a773d9b83757be829dw_ybk_scale15.jpg ---
2025-09-02 22:08:19,043 | INFO | Original found: 256734ca624db14c24b119a773d9b83757be829dw.jpg for 256734ca624db14c24b119a773d9b83757be829dw
2025-09-02 22:08:20,023 | INFO | Validation successful: YBK | MSE=1054.3 | SSIM=0.626 | STATUS: NEEDS_ADJUSTMENT
2025-09-02 22:08:20,024 | INFO | --- Processing: 256734ca624db14c24b119a773d9b83757be829dw_yrd_scale15.jpg ---
2025-09-02 22:08:20,024 | INFO | Original found: 256734ca624db14c24b119a773d9b83757be829dw.jpg for 256734ca624db14c24b119a773d9b83757be829dw
2025-09-02 22:08:21,004 | INFO | Validation successful: YRD | MSE=937.8 | SSIM=0.621 | STATUS: NEEDS_ADJUSTMENT
2025-09-02 22:08:21,005 | INFO | --- Processing: 256734ca624db14c24b119a773d9b83757be829dw_yre_scale15.jpg ---
2025-09-02 22:08:21,006 | INFO | Original found: 256734ca624db14c24b119a773d9b83757be829dw.jpg for 256734ca624db14c24b119a773d9b83757be829dw
2025-09-02 22:08:21,972 | INFO | Validation successful: YRE | MSE=716.5 | SSIM=0.638 | STATUS: NEEDS_ADJUSTMENT
2025-09-02 22:08:21,973 | INFO | --- Processing: 256734ca624db14c24b119a773d9b83757be829dw_yye_scale15.jpg ---
2025-09-02 22:08:21,973 | INFO | Original found: 256734ca624db14c24b119a773d9b83757be829dw.jpg for 256734ca624db14c24b119a773d9b83757be829dw
2025-09-02 22:08:22,978 | INFO | Validation successful: YYE | MSE=1414.3 | SSIM=0.631 | STATUS: NEEDS_ADJUSTMENT
2025-09-02 22:08:22,978 | INFO | --- Processing: ARTE-RUPESTRE_crgb_scale15.jpg ---
2025-09-02 22:08:22,979 | INFO | Original found: ARTE-RUPESTRE.jpg for ARTE-RUPESTRE
2025-09-02 22:08:24,048 | INFO | Validation successful: CRGB | MSE=0.5 | SSIM=1.000 | STATUS: EXCELLENT
2025-09-02 22:08:24,048 | INFO | --- Processing: ARTE-RUPESTRE_lab_scale15.jpg ---
2025-09-02 22:08:24,049 | INFO | Original found: ARTE-RUPESTRE.jpg for ARTE-RUPESTRE
2025-09-02 22:08:25,196 | INFO | Validation successful: LAB | MSE=323.5 | SSIM=0.942 | STATUS: NEEDS_ADJUSTMENT
2025-09-02 22:08:25,196 | INFO | --- Processing: ARTE-RUPESTRE_lds_scale15.jpg ---
2025-09-02 22:08:25,197 | INFO | Original found: ARTE-RUPESTRE.jpg for ARTE-RUPESTRE
2025-09-02 22:08:26,376 | INFO | Validation successful: LDS | MSE=1149.7 | SSIM=0.858 | STATUS: NEEDS_ADJUSTMENT
2025-09-02 22:08:26,376 | INFO | --- Processing: ARTE-RUPESTRE_lre_scale15.jpg ---
2025-09-02 22:08:26,377 | INFO | Original found: ARTE-RUPESTRE.jpg for ARTE-RUPESTRE
2025-09-02 22:08:27,528 | INFO | Validation successful: LRE | MSE=2452.9 | SSIM=0.564 | STATUS: NEEDS_ADJUSTMENT
2025-09-02 22:08:27,528 | INFO | --- Processing: ARTE-RUPESTRE_ybk_scale15.jpg ---
2025-09-02 22:08:27,529 | INFO | Original found: ARTE-RUPESTRE.jpg for ARTE-RUPESTRE
2025-09-02 22:08:28,590 | INFO | Validation successful: YBK | MSE=813.8 | SSIM=0.649 | STATUS: NEEDS_ADJUSTMENT
2025-09-02 22:08:28,590 | INFO | --- Processing: ARTE-RUPESTRE_yrd_scale15.jpg ---
2025-09-02 22:08:28,591 | INFO | Original found: ARTE-RUPESTRE.jpg for ARTE-RUPESTRE
2025-09-02 22:08:29,612 | INFO | Validation successful: YRD | MSE=848.6 | SSIM=0.631 | STATUS: NEEDS_ADJUSTMENT
2025-09-02 22:08:29,612 | INFO | --- Processing: ARTE-RUPESTRE_yre_scale15.jpg ---
2025-09-02 22:08:29,613 | INFO | Original found: ARTE-RUPESTRE.jpg for ARTE-RUPESTRE
2025-09-02 22:08:30,638 | INFO | Validation successful: YRE | MSE=613.7 | SSIM=0.653 | STATUS: NEEDS_ADJUSTMENT
2025-09-02 22:08:30,638 | INFO | --- Processing: ARTE-RUPESTRE_yye_scale15.jpg ---
2025-09-02 22:08:30,639 | INFO | Original found: ARTE-RUPESTRE.jpg for ARTE-RUPESTRE
2025-09-02 22:08:31,663 | INFO | Validation successful: YYE | MSE=1386.6 | SSIM=0.636 | STATUS: NEEDS_ADJUSTMENT
2025-09-02 22:08:31,664 | INFO | --- Processing: SantaCruz-CuevaManos-P2210651b_crgb_scale15.jpg ---
2025-09-02 22:08:31,664 | INFO | Original found: SantaCruz-CuevaManos-P2210651b.jpg for SantaCruz-CuevaManos-P2210651b
2025-09-02 22:08:33,132 | INFO | Validation successful: CRGB | MSE=0.5 | SSIM=1.000 | STATUS: EXCELLENT
2025-09-02 22:08:33,132 | INFO | --- Processing: SantaCruz-CuevaManos-P2210651b_lab_scale15.jpg ---
2025-09-02 22:08:33,133 | INFO | Original found: SantaCruz-CuevaManos-P2210651b.jpg for SantaCruz-CuevaManos-P2210651b
2025-09-02 22:08:35,100 | INFO | Validation successful: LAB | MSE=450.2 | SSIM=0.925 | STATUS: NEEDS_ADJUSTMENT
2025-09-02 22:08:35,100 | INFO | --- Processing: SantaCruz-CuevaManos-P2210651b_lds_scale15.jpg ---
2025-09-02 22:08:35,101 | INFO | Original found: SantaCruz-CuevaManos-P2210651b.jpg for SantaCruz-CuevaManos-P2210651b
2025-09-02 22:08:37,048 | INFO | Validation successful: LDS | MSE=1787.2 | SSIM=0.806 | STATUS: NEEDS_ADJUSTMENT
2025-09-02 22:08:37,048 | INFO | --- Processing: SantaCruz-CuevaManos-P2210651b_lre_scale15.jpg ---
2025-09-02 22:08:37,049 | INFO | Original found: SantaCruz-CuevaManos-P2210651b.jpg for SantaCruz-CuevaManos-P2210651b
2025-09-02 22:08:39,000 | INFO | Validation successful: LRE | MSE=3783.4 | SSIM=0.445 | STATUS: NEEDS_ADJUSTMENT
2025-09-02 22:08:39,000 | INFO | --- Processing: SantaCruz-CuevaManos-P2210651b_ybk_scale15.jpg ---
2025-09-02 22:08:39,002 | INFO | Original found: SantaCruz-CuevaManos-P2210651b.jpg for SantaCruz-CuevaManos-P2210651b
2025-09-02 22:08:40,539 | INFO | Validation successful: YBK | MSE=1073.5 | SSIM=0.625 | STATUS: NEEDS_ADJUSTMENT
2025-09-02 22:08:40,539 | INFO | --- Processing: SantaCruz-CuevaManos-P2210651b_yrd_scale15.jpg ---
2025-09-02 22:08:40,540 | INFO | Original found: SantaCruz-CuevaManos-P2210651b.jpg for SantaCruz-CuevaManos-P2210651b
2025-09-02 22:08:42,048 | INFO | Validation successful: YRD | MSE=942.7 | SSIM=0.621 | STATUS: NEEDS_ADJUSTMENT
2025-09-02 22:08:42,048 | INFO | --- Processing: SantaCruz-CuevaManos-P2210651b_yre_scale15.jpg ---
2025-09-02 22:08:42,049 | INFO | Original found: SantaCruz-CuevaManos-P2210651b.jpg for SantaCruz-CuevaManos-P2210651b
2025-09-02 22:08:43,666 | INFO | Validation successful: YRE | MSE=764.0 | SSIM=0.634 | STATUS: NEEDS_ADJUSTMENT
2025-09-02 22:08:43,666 | INFO | --- Processing: SantaCruz-CuevaManos-P2210651b_yye_scale15.jpg ---
2025-09-02 22:08:43,667 | INFO | Original found: SantaCruz-CuevaManos-P2210651b.jpg for SantaCruz-CuevaManos-P2210651b
2025-09-02 22:08:45,214 | INFO | Validation successful: YYE | MSE=1309.7 | SSIM=0.636 | STATUS: NEEDS_ADJUSTMENT
2025-09-02 22:08:45,214 | INFO | --- Processing: test_crgb_scale15.jpg ---
2025-09-02 22:08:45,220 | INFO | Original found: test.png for test
2025-09-02 22:08:46,422 | INFO | Validation successful: CRGB | MSE=0.5 | SSIM=1.000 | STATUS: EXCELLENT
2025-09-02 22:08:46,423 | INFO | --- Processing: test_lab_scale15.jpg ---
2025-09-02 22:08:46,428 | INFO | Original found: test.png for test
2025-09-02 22:08:47,854 | INFO | Validation successful: LAB | MSE=435.5 | SSIM=0.925 | STATUS: NEEDS_ADJUSTMENT
2025-09-02 22:08:47,854 | INFO | --- Processing: test_lds_scale15.jpg ---
2025-09-02 22:08:47,859 | INFO | Original found: test.png for test
2025-09-02 22:08:49,387 | INFO | Validation successful: LDS | MSE=1919.6 | SSIM=0.777 | STATUS: NEEDS_ADJUSTMENT
2025-09-02 22:08:49,387 | INFO | --- Processing: test_lre_scale15.jpg ---
2025-09-02 22:08:49,393 | INFO | Original found: test.png for test
2025-09-02 22:08:50,831 | INFO | Validation successful: LRE | MSE=3726.0 | SSIM=0.442 | STATUS: NEEDS_ADJUSTMENT
2025-09-02 22:08:50,832 | INFO | --- Processing: test_ybk_scale15.jpg ---
2025-09-02 22:08:50,837 | INFO | Original found: test.png for test
2025-09-02 22:08:52,076 | INFO | Validation successful: YBK | MSE=992.6 | SSIM=0.633 | STATUS: NEEDS_ADJUSTMENT
2025-09-02 22:08:52,077 | INFO | --- Processing: test_yrd_scale15.jpg ---
2025-09-02 22:08:52,082 | INFO | Original found: test.png for test
2025-09-02 22:08:53,301 | INFO | Validation successful: YRD | MSE=972.0 | SSIM=0.618 | STATUS: NEEDS_ADJUSTMENT
2025-09-02 22:08:53,301 | INFO | --- Processing: test_yre_scale15.jpg ---
2025-09-02 22:08:53,305 | INFO | Original found: test.png for test
2025-09-02 22:08:54,520 | INFO | Validation successful: YRE | MSE=727.6 | SSIM=0.639 | STATUS: NEEDS_ADJUSTMENT
2025-09-02 22:08:54,520 | INFO | --- Processing: test_yye_scale15.jpg ---
2025-09-02 22:08:54,527 | INFO | Original found: test.png for test
2025-09-02 22:08:55,871 | INFO | Validation successful: YYE | MSE=1234.7 | SSIM=0.637 | STATUS: NEEDS_ADJUSTMENT
2025-09-02 22:08:55,872 | INFO | ==================================================
2025-09-02 22:08:55,872 | INFO | VALIDATION COMPLETED
2025-09-02 22:08:55,872 | INFO | Successfully validated: 40
2025-09-02 22:08:55,872 | INFO | Failed/Skipped validations: 0
2025-09-02 22:08:55,872 | INFO | Total processed: 40
2025-09-02 22:08:55,873 | INFO | ================================================================================
2025-09-02 22:08:55,873 | INFO | COMPREHENSIVE VALIDATION REPORT
2025-09-02 22:08:55,873 | INFO | ================================================================================
2025-09-02 22:08:55,873 | INFO | RESULTS BY COLORSPACE:
2025-09-02 22:08:55,873 | INFO | --------------------------------------------------------------------------------
2025-09-02 22:08:55,874 | INFO | Colorspace Tests  Excellent  Good   Accept  Needs Fix  Avg MSE  Avg SSIM 
2025-09-02 22:08:55,874 | INFO | --------------------------------------------------------------------------------
2025-09-02 22:08:55,874 | INFO | CRGB       5      5          0      0       0          0.5      1.000    
2025-09-02 22:08:55,874 | INFO | LAB        5      0          0      0       5          436.7    0.928    
2025-09-02 22:08:55,874 | INFO | LDS        5      0          0      0       5          1595.9   0.823    
2025-09-02 22:08:55,874 | INFO | LRE        5      0          0      0       5          3513.1   0.483    
2025-09-02 22:08:55,875 | INFO | YBK        5      0          0      0       5          1001.6   0.632    
2025-09-02 22:08:55,875 | INFO | YRD        5      0          0      0       5          939.5    0.621    
2025-09-02 22:08:55,875 | INFO | YRE        5      0          0      0       5          733.4    0.638    
2025-09-02 22:08:55,875 | INFO | YYE        5      0          0      0       5          1329.2   0.636    
2025-09-02 22:08:55,875 | INFO | ================================================================================
2025-09-02 22:08:55,875 | INFO | FINAL SUMMARY:
2025-09-02 22:08:55,876 | INFO |   Total validations: 40
2025-09-02 22:08:55,876 | INFO |   Excellent: 5 (12.5%)
2025-09-02 22:08:55,876 | INFO |   Good: 0 (0.0%)
2025-09-02 22:08:55,876 | INFO |   Acceptable: 0 (0.0%)
2025-09-02 22:08:55,876 | INFO |   Needs Adjustment: 35 (87.5%)
2025-09-02 22:08:55,876 | INFO |   SUCCESS RATE (Excellent + Good): 12.5%
2025-09-02 22:08:55,877 | INFO |   ❌ REQUIRES SIGNIFICANT ADJUSTMENTS
2025-09-02 22:08:55,879 | INFO | Analysis logs exported to results directory:
2025-09-02 22:08:55,879 | INFO |   - CSV Summary: validation_summary_2025-09-02_220804.csv
2025-09-02 22:08:55,879 | INFO |   - Detailed JSON: validation_report_2025-09-02_220804.json
2025-09-02 22:08:55,879 | INFO |   - Main Log File: G:\dstretch_python\validation_results\review_2025-09-02_220804\validation_log_2025-09-02_220804.log
