2025-09-03 17:39:12,786 | INFO | ================================================================================
2025-09-03 17:39:12,786 | INFO | DSTRETCH PYTHON VALIDATION LOG STARTED
2025-09-03 17:39:12,786 | INFO | Results Directory: G:\dstretch_python\validation_results\review_2025-09-03_173912
2025-09-03 17:39:12,786 | INFO | ================================================================================
2025-09-03 17:39:12,787 | INFO | Validator initialized. All results will be saved to: validation_results\review_2025-09-03_173912
2025-09-03 17:39:12,787 | INFO | Initialized with 21 colorspace mappings
2025-09-03 17:39:12,787 | INFO | Starting automatic validation process
2025-09-03 17:39:12,787 | INFO | Discovering images in: validation_images
2025-09-03 17:39:12,789 | INFO | Discovery complete: 40 processed images found
2025-09-03 17:39:12,789 | INFO | Grouped into 5 original images
2025-09-03 17:39:12,790 | INFO |   13-: 8 variants - ['CRGB', 'LAB', 'LDS', 'LRE', 'YBK', 'YRD', 'YRE', 'YYE']
2025-09-03 17:39:12,790 | INFO |   256734ca624db14c24b119a773d9b83757be829dw: 8 variants - ['CRGB', 'LAB', 'LDS', 'LRE', 'YBK', 'YRD', 'YRE', 'YYE']
2025-09-03 17:39:12,790 | INFO |   ARTE-RUPESTRE: 8 variants - ['CRGB', 'LAB', 'LDS', 'LRE', 'YBK', 'YRD', 'YRE', 'YYE']
2025-09-03 17:39:12,790 | INFO |   SantaCruz-CuevaManos-P2210651b: 8 variants - ['CRGB', 'LAB', 'LDS', 'LRE', 'YBK', 'YRD', 'YRE', 'YYE']
2025-09-03 17:39:12,790 | INFO |   test: 8 variants - ['CRGB', 'LAB', 'LDS', 'LRE', 'YBK', 'YRD', 'YRE', 'YYE']
2025-09-03 17:39:12,790 | INFO | --- Processing: 13-_crgb_scale15.jpg ---
2025-09-03 17:39:12,790 | INFO | Original found: 13-.jpg for 13-
2025-09-03 17:39:14,014 | INFO | Validation successful: CRGB | MSE=0.6 | SSIM=1.000 | STATUS: EXCELLENT
2025-09-03 17:39:14,014 | INFO | --- Processing: 13-_lab_scale15.jpg ---
2025-09-03 17:39:14,015 | INFO | Original found: 13-.jpg for 13-
2025-09-03 17:39:15,173 | INFO | Validation successful: LAB | MSE=3.5 | SSIM=1.000 | STATUS: EXCELLENT
2025-09-03 17:39:15,173 | INFO | --- Processing: 13-_lds_scale15.jpg ---
2025-09-03 17:39:15,173 | INFO | Original found: 13-.jpg for 13-
2025-09-03 17:39:16,343 | INFO | Validation successful: LDS | MSE=3.3 | SSIM=1.000 | STATUS: EXCELLENT
2025-09-03 17:39:16,343 | INFO | --- Processing: 13-_lre_scale15.jpg ---
2025-09-03 17:39:16,344 | INFO | Original found: 13-.jpg for 13-
2025-09-03 17:39:17,519 | INFO | Validation successful: LRE | MSE=1.0 | SSIM=1.000 | STATUS: EXCELLENT
2025-09-03 17:39:17,519 | INFO | --- Processing: 13-_ybk_scale15.jpg ---
2025-09-03 17:39:17,520 | INFO | Original found: 13-.jpg for 13-
2025-09-03 17:39:18,526 | INFO | Validation successful: YBK | MSE=0.6 | SSIM=1.000 | STATUS: EXCELLENT
2025-09-03 17:39:18,526 | INFO | --- Processing: 13-_yrd_scale15.jpg ---
2025-09-03 17:39:18,526 | INFO | Original found: 13-.jpg for 13-
2025-09-03 17:39:19,538 | INFO | Validation successful: YRD | MSE=0.6 | SSIM=1.000 | STATUS: EXCELLENT
2025-09-03 17:39:19,538 | INFO | --- Processing: 13-_yre_scale15.jpg ---
2025-09-03 17:39:19,538 | INFO | Original found: 13-.jpg for 13-
2025-09-03 17:39:20,616 | INFO | Validation successful: YRE | MSE=0.6 | SSIM=1.000 | STATUS: EXCELLENT
2025-09-03 17:39:20,616 | INFO | --- Processing: 13-_yye_scale15.jpg ---
2025-09-03 17:39:20,617 | INFO | Original found: 13-.jpg for 13-
2025-09-03 17:39:21,613 | INFO | Validation successful: YYE | MSE=0.6 | SSIM=1.000 | STATUS: EXCELLENT
2025-09-03 17:39:21,613 | INFO | --- Processing: 256734ca624db14c24b119a773d9b83757be829dw_crgb_scale15.jpg ---
2025-09-03 17:39:21,613 | INFO | Original found: 256734ca624db14c24b119a773d9b83757be829dw.jpg for 256734ca624db14c24b119a773d9b83757be829dw
2025-09-03 17:39:22,486 | INFO | Validation successful: CRGB | MSE=0.6 | SSIM=1.000 | STATUS: EXCELLENT
2025-09-03 17:39:22,486 | INFO | --- Processing: 256734ca624db14c24b119a773d9b83757be829dw_lab_scale15.jpg ---
2025-09-03 17:39:22,487 | INFO | Original found: 256734ca624db14c24b119a773d9b83757be829dw.jpg for 256734ca624db14c24b119a773d9b83757be829dw
2025-09-03 17:39:23,512 | INFO | Validation successful: LAB | MSE=1.6 | SSIM=1.000 | STATUS: EXCELLENT
2025-09-03 17:39:23,513 | INFO | --- Processing: 256734ca624db14c24b119a773d9b83757be829dw_lds_scale15.jpg ---
2025-09-03 17:39:23,513 | INFO | Original found: 256734ca624db14c24b119a773d9b83757be829dw.jpg for 256734ca624db14c24b119a773d9b83757be829dw
2025-09-03 17:39:24,589 | INFO | Validation successful: LDS | MSE=1.9 | SSIM=1.000 | STATUS: EXCELLENT
2025-09-03 17:39:24,589 | INFO | --- Processing: 256734ca624db14c24b119a773d9b83757be829dw_lre_scale15.jpg ---
2025-09-03 17:39:24,590 | INFO | Original found: 256734ca624db14c24b119a773d9b83757be829dw.jpg for 256734ca624db14c24b119a773d9b83757be829dw
2025-09-03 17:39:25,597 | INFO | Validation successful: LRE | MSE=1.0 | SSIM=1.000 | STATUS: EXCELLENT
2025-09-03 17:39:25,597 | INFO | --- Processing: 256734ca624db14c24b119a773d9b83757be829dw_ybk_scale15.jpg ---
2025-09-03 17:39:25,597 | INFO | Original found: 256734ca624db14c24b119a773d9b83757be829dw.jpg for 256734ca624db14c24b119a773d9b83757be829dw
2025-09-03 17:39:26,488 | INFO | Validation successful: YBK | MSE=0.6 | SSIM=1.000 | STATUS: EXCELLENT
2025-09-03 17:39:26,488 | INFO | --- Processing: 256734ca624db14c24b119a773d9b83757be829dw_yrd_scale15.jpg ---
2025-09-03 17:39:26,489 | INFO | Original found: 256734ca624db14c24b119a773d9b83757be829dw.jpg for 256734ca624db14c24b119a773d9b83757be829dw
2025-09-03 17:39:27,387 | INFO | Validation successful: YRD | MSE=0.6 | SSIM=1.000 | STATUS: EXCELLENT
2025-09-03 17:39:27,387 | INFO | --- Processing: 256734ca624db14c24b119a773d9b83757be829dw_yre_scale15.jpg ---
2025-09-03 17:39:27,388 | INFO | Original found: 256734ca624db14c24b119a773d9b83757be829dw.jpg for 256734ca624db14c24b119a773d9b83757be829dw
2025-09-03 17:39:28,323 | INFO | Validation successful: YRE | MSE=0.6 | SSIM=1.000 | STATUS: EXCELLENT
2025-09-03 17:39:28,324 | INFO | --- Processing: 256734ca624db14c24b119a773d9b83757be829dw_yye_scale15.jpg ---
2025-09-03 17:39:28,324 | INFO | Original found: 256734ca624db14c24b119a773d9b83757be829dw.jpg for 256734ca624db14c24b119a773d9b83757be829dw
2025-09-03 17:39:29,281 | INFO | Validation successful: YYE | MSE=0.6 | SSIM=1.000 | STATUS: EXCELLENT
2025-09-03 17:39:29,281 | INFO | --- Processing: ARTE-RUPESTRE_crgb_scale15.jpg ---
2025-09-03 17:39:29,281 | INFO | Original found: ARTE-RUPESTRE.jpg for ARTE-RUPESTRE
2025-09-03 17:39:30,199 | INFO | Validation successful: CRGB | MSE=0.5 | SSIM=1.000 | STATUS: EXCELLENT
2025-09-03 17:39:30,199 | INFO | --- Processing: ARTE-RUPESTRE_lab_scale15.jpg ---
2025-09-03 17:39:30,200 | INFO | Original found: ARTE-RUPESTRE.jpg for ARTE-RUPESTRE
2025-09-03 17:39:31,237 | INFO | Validation successful: LAB | MSE=1.2 | SSIM=1.000 | STATUS: EXCELLENT
2025-09-03 17:39:31,238 | INFO | --- Processing: ARTE-RUPESTRE_lds_scale15.jpg ---
2025-09-03 17:39:31,238 | INFO | Original found: ARTE-RUPESTRE.jpg for ARTE-RUPESTRE
2025-09-03 17:39:32,288 | INFO | Validation successful: LDS | MSE=1.6 | SSIM=1.000 | STATUS: EXCELLENT
2025-09-03 17:39:32,288 | INFO | --- Processing: ARTE-RUPESTRE_lre_scale15.jpg ---
2025-09-03 17:39:32,289 | INFO | Original found: ARTE-RUPESTRE.jpg for ARTE-RUPESTRE
2025-09-03 17:39:33,347 | INFO | Validation successful: LRE | MSE=0.9 | SSIM=1.000 | STATUS: EXCELLENT
2025-09-03 17:39:33,347 | INFO | --- Processing: ARTE-RUPESTRE_ybk_scale15.jpg ---
2025-09-03 17:39:33,347 | INFO | Original found: ARTE-RUPESTRE.jpg for ARTE-RUPESTRE
2025-09-03 17:39:34,339 | INFO | Validation successful: YBK | MSE=0.6 | SSIM=1.000 | STATUS: EXCELLENT
2025-09-03 17:39:34,340 | INFO | --- Processing: ARTE-RUPESTRE_yrd_scale15.jpg ---
2025-09-03 17:39:34,340 | INFO | Original found: ARTE-RUPESTRE.jpg for ARTE-RUPESTRE
2025-09-03 17:39:35,299 | INFO | Validation successful: YRD | MSE=0.6 | SSIM=1.000 | STATUS: EXCELLENT
2025-09-03 17:39:35,300 | INFO | --- Processing: ARTE-RUPESTRE_yre_scale15.jpg ---
2025-09-03 17:39:35,300 | INFO | Original found: ARTE-RUPESTRE.jpg for ARTE-RUPESTRE
2025-09-03 17:39:36,225 | INFO | Validation successful: YRE | MSE=0.6 | SSIM=1.000 | STATUS: EXCELLENT
2025-09-03 17:39:36,225 | INFO | --- Processing: ARTE-RUPESTRE_yye_scale15.jpg ---
2025-09-03 17:39:36,225 | INFO | Original found: ARTE-RUPESTRE.jpg for ARTE-RUPESTRE
2025-09-03 17:39:37,153 | INFO | Validation successful: YYE | MSE=0.6 | SSIM=1.000 | STATUS: EXCELLENT
2025-09-03 17:39:37,153 | INFO | --- Processing: SantaCruz-CuevaManos-P2210651b_crgb_scale15.jpg ---
2025-09-03 17:39:37,154 | INFO | Original found: SantaCruz-CuevaManos-P2210651b.jpg for SantaCruz-CuevaManos-P2210651b
2025-09-03 17:39:38,505 | INFO | Validation successful: CRGB | MSE=0.5 | SSIM=1.000 | STATUS: EXCELLENT
2025-09-03 17:39:38,505 | INFO | --- Processing: SantaCruz-CuevaManos-P2210651b_lab_scale15.jpg ---
2025-09-03 17:39:38,506 | INFO | Original found: SantaCruz-CuevaManos-P2210651b.jpg for SantaCruz-CuevaManos-P2210651b
2025-09-03 17:39:40,410 | INFO | Validation successful: LAB | MSE=1.7 | SSIM=1.000 | STATUS: EXCELLENT
2025-09-03 17:39:40,410 | INFO | --- Processing: SantaCruz-CuevaManos-P2210651b_lds_scale15.jpg ---
2025-09-03 17:39:40,411 | INFO | Original found: SantaCruz-CuevaManos-P2210651b.jpg for SantaCruz-CuevaManos-P2210651b
2025-09-03 17:39:42,272 | INFO | Validation successful: LDS | MSE=1.2 | SSIM=1.000 | STATUS: EXCELLENT
2025-09-03 17:39:42,272 | INFO | --- Processing: SantaCruz-CuevaManos-P2210651b_lre_scale15.jpg ---
2025-09-03 17:39:42,273 | INFO | Original found: SantaCruz-CuevaManos-P2210651b.jpg for SantaCruz-CuevaManos-P2210651b
2025-09-03 17:39:44,131 | INFO | Validation successful: LRE | MSE=1.0 | SSIM=0.999 | STATUS: EXCELLENT
2025-09-03 17:39:44,131 | INFO | --- Processing: SantaCruz-CuevaManos-P2210651b_ybk_scale15.jpg ---
2025-09-03 17:39:44,132 | INFO | Original found: SantaCruz-CuevaManos-P2210651b.jpg for SantaCruz-CuevaManos-P2210651b
2025-09-03 17:39:45,572 | INFO | Validation successful: YBK | MSE=0.6 | SSIM=1.000 | STATUS: EXCELLENT
2025-09-03 17:39:45,572 | INFO | --- Processing: SantaCruz-CuevaManos-P2210651b_yrd_scale15.jpg ---
2025-09-03 17:39:45,573 | INFO | Original found: SantaCruz-CuevaManos-P2210651b.jpg for SantaCruz-CuevaManos-P2210651b
2025-09-03 17:39:47,056 | INFO | Validation successful: YRD | MSE=0.6 | SSIM=1.000 | STATUS: EXCELLENT
2025-09-03 17:39:47,057 | INFO | --- Processing: SantaCruz-CuevaManos-P2210651b_yre_scale15.jpg ---
2025-09-03 17:39:47,058 | INFO | Original found: SantaCruz-CuevaManos-P2210651b.jpg for SantaCruz-CuevaManos-P2210651b
2025-09-03 17:39:48,479 | INFO | Validation successful: YRE | MSE=0.6 | SSIM=1.000 | STATUS: EXCELLENT
2025-09-03 17:39:48,479 | INFO | --- Processing: SantaCruz-CuevaManos-P2210651b_yye_scale15.jpg ---
2025-09-03 17:39:48,480 | INFO | Original found: SantaCruz-CuevaManos-P2210651b.jpg for SantaCruz-CuevaManos-P2210651b
2025-09-03 17:39:49,904 | INFO | Validation successful: YYE | MSE=0.6 | SSIM=1.000 | STATUS: EXCELLENT
2025-09-03 17:39:49,904 | INFO | --- Processing: test_crgb_scale15.jpg ---
2025-09-03 17:39:49,909 | INFO | Original found: test.png for test
2025-09-03 17:39:51,015 | INFO | Validation successful: CRGB | MSE=0.5 | SSIM=1.000 | STATUS: EXCELLENT
2025-09-03 17:39:51,016 | INFO | --- Processing: test_lab_scale15.jpg ---
2025-09-03 17:39:51,021 | INFO | Original found: test.png for test
2025-09-03 17:39:52,339 | INFO | Validation successful: LAB | MSE=1.9 | SSIM=1.000 | STATUS: EXCELLENT
2025-09-03 17:39:52,339 | INFO | --- Processing: test_lds_scale15.jpg ---
2025-09-03 17:39:52,344 | INFO | Original found: test.png for test
2025-09-03 17:39:53,817 | INFO | Validation successful: LDS | MSE=2.3 | SSIM=1.000 | STATUS: EXCELLENT
2025-09-03 17:39:53,817 | INFO | --- Processing: test_lre_scale15.jpg ---
2025-09-03 17:39:53,822 | INFO | Original found: test.png for test
2025-09-03 17:39:55,153 | INFO | Validation successful: LRE | MSE=1.2 | SSIM=0.999 | STATUS: EXCELLENT
2025-09-03 17:39:55,153 | INFO | --- Processing: test_ybk_scale15.jpg ---
2025-09-03 17:39:55,158 | INFO | Original found: test.png for test
2025-09-03 17:39:56,293 | INFO | Validation successful: YBK | MSE=0.6 | SSIM=1.000 | STATUS: EXCELLENT
2025-09-03 17:39:56,293 | INFO | --- Processing: test_yrd_scale15.jpg ---
2025-09-03 17:39:56,297 | INFO | Original found: test.png for test
2025-09-03 17:39:57,434 | INFO | Validation successful: YRD | MSE=0.6 | SSIM=1.000 | STATUS: EXCELLENT
2025-09-03 17:39:57,434 | INFO | --- Processing: test_yre_scale15.jpg ---
2025-09-03 17:39:57,439 | INFO | Original found: test.png for test
2025-09-03 17:39:58,622 | INFO | Validation successful: YRE | MSE=0.6 | SSIM=1.000 | STATUS: EXCELLENT
2025-09-03 17:39:58,623 | INFO | --- Processing: test_yye_scale15.jpg ---
2025-09-03 17:39:58,627 | INFO | Original found: test.png for test
2025-09-03 17:39:59,769 | INFO | Validation successful: YYE | MSE=0.6 | SSIM=1.000 | STATUS: EXCELLENT
2025-09-03 17:39:59,769 | INFO | ==================================================
2025-09-03 17:39:59,769 | INFO | VALIDATION COMPLETED
2025-09-03 17:39:59,770 | INFO | Successfully validated: 40
2025-09-03 17:39:59,770 | INFO | Failed/Skipped validations: 0
2025-09-03 17:39:59,770 | INFO | Total processed: 40
2025-09-03 17:39:59,770 | INFO | ================================================================================
2025-09-03 17:39:59,770 | INFO | COMPREHENSIVE VALIDATION REPORT
2025-09-03 17:39:59,770 | INFO | ================================================================================
2025-09-03 17:39:59,771 | INFO | RESULTS BY COLORSPACE:
2025-09-03 17:39:59,771 | INFO | --------------------------------------------------------------------------------
2025-09-03 17:39:59,771 | INFO | Colorspace Tests  Excellent  Good   Accept  Needs Fix  Avg MSE  Avg SSIM 
2025-09-03 17:39:59,771 | INFO | --------------------------------------------------------------------------------
2025-09-03 17:39:59,771 | INFO | CRGB       5      5          0      0       0          0.5      1.000    
2025-09-03 17:39:59,771 | INFO | LAB        5      5          0      0       0          2.0      1.000    
2025-09-03 17:39:59,772 | INFO | LDS        5      5          0      0       0          2.1      1.000    
2025-09-03 17:39:59,772 | INFO | LRE        5      5          0      0       0          1.0      1.000    
2025-09-03 17:39:59,772 | INFO | YBK        5      5          0      0       0          0.6      1.000    
2025-09-03 17:39:59,772 | INFO | YRD        5      5          0      0       0          0.6      1.000    
2025-09-03 17:39:59,772 | INFO | YRE        5      5          0      0       0          0.6      1.000    
2025-09-03 17:39:59,773 | INFO | YYE        5      5          0      0       0          0.6      1.000    
2025-09-03 17:39:59,773 | INFO | ================================================================================
2025-09-03 17:39:59,773 | INFO | FINAL SUMMARY:
2025-09-03 17:39:59,773 | INFO |   Total validations: 40
2025-09-03 17:39:59,773 | INFO |   Excellent: 40 (100.0%)
2025-09-03 17:39:59,773 | INFO |   Good: 0 (0.0%)
2025-09-03 17:39:59,774 | INFO |   Acceptable: 0 (0.0%)
2025-09-03 17:39:59,774 | INFO |   Needs Adjustment: 0 (0.0%)
2025-09-03 17:39:59,774 | INFO |   SUCCESS RATE (Excellent + Good): 100.0%
2025-09-03 17:39:59,774 | INFO |   🎉 VALIDATION SUCCESSFUL
2025-09-03 17:39:59,776 | INFO | Analysis logs exported to results directory:
2025-09-03 17:39:59,776 | INFO |   - CSV Summary: validation_summary_2025-09-03_173912.csv
2025-09-03 17:39:59,776 | INFO |   - Detailed JSON: validation_report_2025-09-03_173912.json
2025-09-03 17:39:59,777 | INFO |   - Main Log File: G:\dstretch_python\validation_results\review_2025-09-03_173912\validation_log_2025-09-03_173912.log
